{
  "specialist": "PalSystem_Dragapult",
  "candidate_version": "v001-candidate",
  "baseline_version": "v000-baseline",
  "opponent": "specialist_previous",
  "stage": "smoke",
  "seed_set": "2026081507",
  "games": 20,
  "wins": 13,
  "losses": 7,
  "draws": 0,
  "timeouts": 0,
  "illegal_actions": 0,
  "crashes": 0,
  "average_steps": 188.4,
  "average_decision_time_ms": 10.301245327273769,
  "max_decision_time_ms": 228.19830000662478,
  "win_rate": 0.65,
  "confidence_interval": [
    0.43285051021946463,
    0.8188104521320554
  ],
  "z_score": 1.341640786499874,
  "p_value": 0.17971249487899985,
  "started_at": "2026-08-14T23:49:52.924238+00:00",
  "finished_at": "2026-08-14T23:50:39.236399+00:00",
  "duration_seconds": 46.312024500002735,
  "errors": []
}
